{
  "$schema": "https://json-schema.org/draft/2020-12/schema",
  "title": "Coding Quality Loop Orchestration Config",
  "type": "object",
  "required": [
    "version",
    "profiles",
    "steps",
    "policy_guard",
    "routing_defaults"
  ],
  "properties": {
    "$schema": {
      "type": "string"
    },
    "version": {
      "type": "string",
      "const": "5.1.0",
      "description": "Config SCHEMA lineage version — the version of this config's shape, which last changed in release 5.1.0. It does not track the package release version. check-config and an eval pin this const against the engine constant (CONFIG_SCHEMA_VERSION) and the example config."
    },
    "description": {
      "type": "string"
    },
    "base": {
      "type": [
        "string",
        "null"
      ],
      "description": "Default git base ref for the diff-grounded gates. Precedence: --base flag > QUALITY_LOOP_BASE env > this key > the built-in ladder (origin/main → origin/master → main → master). Together with tests.path_markers and high_risk_paths this is the COMPLETE deliberate gate-config surface; everything else about the gates is deliberately not configurable."
    },
    "tests": {
      "type": "object",
      "description": "Gate-config key 2 of 3: tests.path_markers ADDS path substrings (e.g. \"evals/\") to the built-in test markers (test/spec/__tests__) used by test-weakening, test-shrinkage, and bugfix-test co-presence. Additive only — the built-ins always apply.",
      "properties": {
        "path_markers": {
          "type": "array",
          "items": {
            "type": "string",
            "minLength": 1
          }
        }
      },
      "additionalProperties": false
    },
    "high_risk_paths": {
      "type": "array",
      "description": "Gate-config key 3 of 3: extra high-risk path entries (a directory/file name matched as a path component or basename, or a slash-containing path prefix like \"services/identity\") ADDED to the built-in high-tier paths (auth/, payments/, migrations/, terraform/, lockfiles, .env*). A changed path matching one forces high-risk gates. Additive only.",
      "items": {
        "type": "string",
        "minLength": 1
      }
    },
    "protect_harness": {
      "type": "boolean",
      "description": "PreToolUse-guard key (not a gate key). Default when absent: on. The shipped guard denies edits to the gate scripts, hook shims, this config, and the install manifest — tamper evidence, not immutability. This repo's own config sets it false because here the gate scripts are the workpiece. Shape-validated by check-config."
    },
    "enforcement": {
      "type": "string",
      "enum": ["required", "advisory"],
      "description": "PreToolUse-guard key (not a gate key). \"required\" makes the guard block medium/high-risk edits until the record passes PLAN + MINIMALITY_GATE; any other or absent value is advisory. Read best-effort by the guard; not shape-validated by check-config today."
    },
    "profiles": {
      "type": "object",
      "additionalProperties": {
        "type": "object",
        "required": [
          "role"
        ],
        "properties": {
          "role": {
            "type": "string"
          },
          "model": {
            "type": [
              "string",
              "null"
            ]
          },
          "tools": {
            "type": "array",
            "items": {
              "type": "string"
            }
          },
          "independent_session": {
            "type": "boolean"
          },
          "deterministic": {
            "type": "boolean"
          }
        },
        "additionalProperties": true
      }
    },
    "steps": {
      "type": "array",
      "minItems": 1,
      "items": {
        "type": "object",
        "required": [
          "step",
          "profile",
          "required_artifacts",
          "gates"
        ],
        "properties": {
          "step": {
            "type": "string",
            "enum": [
              "INTAKE",
              "EXPLORE",
              "PLAN",
              "MINIMALITY_GATE",
              "IMPLEMENT_SLICE",
              "VERIFY",
              "REVIEW",
              "PACKAGE",
              "RETROSPECT"
            ]
          },
          "profile": {
            "type": "string"
          },
          "model_class": {
            "type": "string",
            "enum": [
              "cheap_fast",
              "strong_reasoning",
              "code_specialized",
              "deterministic"
            ]
          },
          "tools": {
            "type": "array",
            "items": {
              "type": "string"
            }
          },
          "independent_session": {
            "type": "boolean"
          },
          "required_artifacts": {
            "type": "array",
            "items": {
              "type": "string"
            }
          },
          "gates": {
            "type": "array",
            "items": {
              "type": "string"
            }
          }
        },
        "additionalProperties": true
      }
    },
    "policy_guard": {
      "type": "object"
    },
    "routing_defaults": {
      "type": "object",
      "required": [
        "low",
        "medium",
        "high"
      ],
      "properties": {
        "low": {
          "type": "object"
        },
        "medium": {
          "type": "object"
        },
        "high": {
          "type": "object"
        }
      },
      "additionalProperties": true
    },
    "advisor": {
      "type": "object",
      "description": "Retired v3–v4 advisor/Smart Friend block — v5.0.0 inverted the topology (the orchestrator reasons at the top; workers never consult upward). Tolerated for legacy configs; no code reads it.",
      "properties": {
        "description": {
          "type": "string"
        },
        "enabled_for": {
          "type": "array",
          "items": {
            "type": "string",
            "enum": [
              "tiny",
              "small",
              "medium",
              "mission"
            ]
          }
        },
        "executor_model_class": {
          "type": "string",
          "enum": [
            "cheap_fast",
            "strong_reasoning",
            "code_specialized"
          ]
        },
        "advisor_model_class": {
          "type": "string",
          "enum": [
            "cheap_fast",
            "strong_reasoning",
            "code_specialized"
          ]
        },
        "advisor_calls_tools": {
          "type": "boolean"
        },
        "max_uses": {
          "type": "integer",
          "minimum": 1
        }
      },
      "additionalProperties": true
    },
    "memory": {
      "type": "object",
      "properties": {
        "lessons_store": {
          "type": "string",
          "enum": [
            "files"
          ]
        },
        "location": {
          "type": "string",
          "enum": [
            "checked_in",
            "local"
          ]
        },
        "recall_budget_chars": {
          "type": "integer",
          "minimum": 1
        }
      },
      "additionalProperties": true
    },
    "control_plane": {
      "type": "object",
      "description": "Local observability plane: SQLite index + 127.0.0.1 dashboard served by control-serve. Opt-in: nothing is collected unless enabled is true.",
      "properties": {
        "enabled": {
          "type": "boolean"
        },
        "autostart": {
          "type": "boolean"
        },
        "port": {
          "type": "integer",
          "minimum": 1024,
          "maximum": 65535
        },
        "retention_days": {
          "type": "integer",
          "minimum": 1
        },
        "prices": {
          "type": "object",
          "description": "User-supplied model prices (USD per million tokens), matched by substring against indexed model ids. This repo ships no vendor price data.",
          "additionalProperties": {
            "type": "object",
            "properties": {
              "input_per_mtok": {
                "type": "number",
                "minimum": 0
              },
              "output_per_mtok": {
                "type": "number",
                "minimum": 0
              },
              "cache_read_per_mtok": {
                "type": "number",
                "minimum": 0
              },
              "cache_creation_per_mtok": {
                "type": "number",
                "minimum": 0
              }
            },
            "additionalProperties": false
          }
        },
        "note": {
          "type": "string"
        },
        "description": {
          "type": "string"
        }
      },
      "additionalProperties": false
    },
    "model_routing": {
      "type": "object",
      "description": "Per-model-class routing applied by setup-models. Optional v2.3 block; absent = no routing configured.",
      "properties": {
        "description": {
          "type": "string"
        },
        "host": {
          "type": [
            "string",
            "null"
          ],
          "enum": [
            "claude-code",
            "droid",
            "codex",
            "pi",
            null
          ]
        },
        "host_models": {
          "type": "object",
          "additionalProperties": {
            "type": "object",
            "additionalProperties": {
              "type": "object",
              "properties": {
                "model": {
                  "type": [
                    "string",
                    "null"
                  ]
                },
                "family": {
                  "type": [
                    "string",
                    "null"
                  ],
                  "description": "Optional model family (e.g. claude, gpt, glm) for the reviewer-heterogeneity check. Wins over the well-known-prefix match; unknown families are skipped, never failed."
                },
                "thinking": {
                  "type": [
                    "string",
                    "null"
                  ],
                  "enum": [
                    "minimal",
                    "low",
                    "medium",
                    "high",
                    "xhigh",
                    "max",
                    null
                  ],
                  "description": "Reasoning effort. CQL defaults to 'high' as a cost-control policy pending controlled measurement; higher effort may help demanding tasks. check-config rejects xhigh/max unless allow_overthink is true on this block."
                },
                "allow_overthink": {
                  "type": "boolean",
                  "description": "Set true to permit xhigh/max on this model_class for a genuinely ambiguous, architecture-sensitive case. Without it, check-config fails on xhigh/max."
                },
                "note": {
                  "type": "string"
                }
              },
              "additionalProperties": false
            }
          }
        },
        "agents": {
          "type": "object",
          "additionalProperties": {
            "oneOf": [
              {
                "type": "string",
                "enum": [
                  "cheap_fast",
                  "strong_reasoning",
                  "code_specialized"
                ]
              },
              {
                "type": "object",
                "required": [
                  "class"
                ],
                "properties": {
                  "host": {
                    "type": "string",
                    "enum": [
                      "claude-code",
                      "droid",
                      "codex",
                      "pi"
                    ]
                  },
                  "class": {
                    "type": "string",
                    "enum": [
                      "cheap_fast",
                      "strong_reasoning",
                      "code_specialized"
                    ]
                  },
                  "note": {
                    "type": "string"
                  }
                },
                "additionalProperties": true
              }
            ]
          },
          "description": "Agent file -> model_class. A plain string routes the agent on the default host (v4.1 shape); an object pins it to another host for multi-harness topologies."
        },
        "main_session": {
          "type": [
            "object",
            "null"
          ],
          "description": "Declares where the implementer (main session) runs. Nothing is rewritten for it -- it feeds the cross-host reviewer-heterogeneity check, brief, and print-host output. Must resolve to a host: set host here or model_routing.host (check-config errors otherwise).",
          "properties": {
            "host": {
              "type": "string",
              "enum": [
                "claude-code",
                "droid",
                "codex",
                "pi"
              ]
            },
            "class": {
              "type": "string",
              "enum": [
                "cheap_fast",
                "strong_reasoning",
                "code_specialized"
              ]
            },
            "model": {
              "type": [
                "string",
                "null"
              ]
            },
            "note": {
              "type": "string"
            }
          },
          "additionalProperties": true
        },
        "allow_same_family": {
          "type": "boolean",
          "description": "Explicit escape hatch: accept implementer and fresh_reviewer resolving to the same model FAMILY (never the same model). Without it, check-config fails same-family review on medium+."
        },
        "families": {
          "type": "object",
          "additionalProperties": {
            "type": "string",
            "minLength": 1
          },
          "description": "User-taught model families: {model-id-or-prefix: family}, merged OVER the built-in well-known table so new model names classify without a release. Matched by exact id, then longest prefix, then as extra tokens; an explicit per-block family field still wins. Without an entry, unknown ids make the heterogeneity check report SKIPPED."
        },
        "as_of": {
          "type": "string",
          "pattern": "^[0-9]{4}-[0-9]{2}-[0-9]{2}$",
          "description": "Date (YYYY-MM-DD) this model menu was last reviewed. brief prints a one-line 'model menu may be stale' warning when it is more than 90 days old."
        }
      },
      "additionalProperties": true
    }
  },
  "additionalProperties": false
}
